id,rowid,entity,text
11082,34711,0,as protests and riots continue in the wake of george floyds death parents across the country are figuring out how to talk to their children about the protests and fighting racismheres what the experts say //tco/wbefpksh //tco/rewwterf
7997,26179,1,i am asking you to help us black people in america george floyds brother philonise floyd called for the un human rights council to create an independent commission to study the killing of black people by the police in the us read more //tco/wbsxettz //tco/yzxpkqrfp
16335,47807,2,police unions are the one of the most important guardians of law enforcement in the united states—negotiating salary benefits and most importantly protections for their members //tco/ptofpszss
14175,42464,2,henryrodgersdc a majority of the minneapolis city council unanimously voted to dismantle the citys police department as their solut…
3044,10203,5,mlb ratings fell off after opening day amid support for black lives matter movement //tco/icribtvo
8632,28166,1,civil rights activist rev jesse jackson is calling for congress to pass an antilynching law and eliminate protections for police officers from lawsuits //tco/toerfkjeod
17273,50229,4,speaker pelosi says she will absolutely positively not apologize for saying that republicans are trying to get away with the murder of george floyd with their police reform bill //tco/htptyraw
16262,47625,4,republicans wade into police reform proposals //tco/eyhhpfisz
11944,38028,0,sharpton police reform bill take center stage at national mall //tco/icruaxdgln //tco/ryywbqzjg
8915,28449,1,a minute kneeling prayer circle to represent and experience the time that george floyd was pinned down by police at this intersection feel the pain //tco/nlaiwolkr
13248,40574,2,one of the three officers involved in the fatal march shooting of breonna taylor will be fired //tco/kdttdnrp
13993,41750,2,officer shot and killed in #oakland during george floyd #protest was black //tco/ippdkria washtimes
15195,44953,3,san fransisco mayor londonbreed says shell redirect money from the police to the african american communitypeople want reform… part of those changes would also mean that there will be a reduction of what we spend on our departments in our cities #mayorswhomatter //tco/ynhekdvnn
13995,41752,3,rep ilhan omar protesters feeling terrorized by national guard troops militarized police //tco/yrmjsqn //tco/ttrqccghf
4791,15998,0,karlos k hill of the university of oklahoma on president trumps tulsa rally i hope that his visit to tulsa is about paying homage to the victims and survivors of the race massacre that died years ago as well as paying homage to the memory of george floyd //tco/lwhsghna
2530,8181,1,vandal dumps red paint on black lives matter mural in front of trump tower then runs off //tco/yxnawqql //tco/lztxiwzhb
12120,38204,0,prosecutors investigate irregularities in texas police officers arrest of george floyd //tco/xiejrsicc //tco/djlspefjs
15359,45693,4,on pres trumps campaign ads falsely claiming that joe biden wants to defund the police joyannreid says trump has based his campaign strategy on painting a false portrait of cities under siege //tco/zqdmb
4153,13857,1,black lives matter leader if this country doesnt give us what we want then we will burn down this system video //tco/nzpmohlf via gatewaypundit cristinalaila
11742,36532,0,dave patrick underwood died from gunshot wounds sustained after someone fired shots from a vehicle friday night the fbi said sunday //tco/dqmmljls
16416,47976,0,usatodaypodcast the senate tackles police reform things to know wednesday //tco/cmgjxivrrw
7462,24029,2,the louisville metro police department said they are investigating accusations made by at least two women who say they were sexually assaulted by one of the officers involved in the february shooting of breonna taylor //tco/yldepree
11534,36324,5,a host of affiliated gyms sponsors and athletes all moved to disassociate themselves with the crossfit brand following a series of comments from company founder and ceo greg glassman about the death of george floyd //tco/aatrtccs
8956,28490,1,maurabarrettnbc min before curfew goes into effect protestors are across from the police station in dsm chanting say his name ge…
4717,15924,0,since the police killing of george floyd white americans have been confronting racism in the us in a way that both illustrates the work yet to be done on this score and stands out from trumps recent juneteenth fiasco brandontensley writes analysis //tco/pzpgscfzz
14592,43055,1,wendys torched totally destroyed by looters in george floyd minneapolis riots //tco/pubnsossj via gatewaypundit
7996,26178,0,it has surprised me and it gives me hope i thought what i had done was in vainveterans of the civil rights era who marched with dr martin luther king jr said that weeks of protests over police violence have left them trepidatious and hopeful //tco/arihwnbrfd
13689,41015,0,i dont need to wait on the feds this is a violation of minnesota state law this is murder its either murder one two or three under minnesota law but its one of the three tgowdysc believes the mn officer is guilty of murdering george floyd //tco/lpsaszdp
12457,38541,2,just in minneapolis school board terminates contract with police department over george floyd death //tco/tyystinvl //tco/huqzkoq
10105,32479,0,tune in norahodonnell and cbseveningnews are broadcasting from minneapolis as thousands continue to mourn george floyd and protest racial injustice //tco/vaprylgwy //tco/ktpbbozg
14824,43613,0,i stand with all mothers who have lost sons to these type of events we do demand change we cant lose another life to such tragedy something has to change wanda cooper mother of ahmaud arbery who was fatally shot while jogging in georgia //tco/fiakobkb //tco/ucuxdx
12220,38304,5,crossfit ceo told staff were not mourning for george floyd report //tco/uwsruzxduk //tco/hatqtbdt
5765,18422,0,george floyds memorial in brooklyn included praise worship and gospel music it was one of the most authentic expressions of black culture that i have seen during these protests the photographer mark clennon said //tco/wmwqzaxqp
6052,19592,4,chrislhayes remembers the life of george floyd floyd was known in the community as a protector a provider who didnt have a hateful bone in his body //tco/teptljz
14412,42701,2,former disney star cole sprouse arrested during george floyd protests in california //tco/pppgqlfa
14235,42524,4,exclusive sen kelly loeffler to introduce resolution honoring george floyds life — says congress will continue to fund police //tco/pehzzstvg
7409,23976,2,what about the dozens of officers who watched where was the good cop for george floyd i dont want to hear there are good cops dounya zayer said //tco/tieyggnq
3052,10211,1,between faucis lines yes the black lives matter protests likely spread the coronavirus //tco/pewsierv
7799,25131,0,aziz asmar painted a mural of george floyd in wartorn idlib in syria we have a humanitarian duty to sympathize with all the oppressed in the world he says heres how people around the world are honoring black lives and demanding racial equality //tco/tgajucgq
8380,27914,3,now more than ever we need a president who will unite this country we need a president who in george floyds memory instead of using the bible as a prop will heed its words to act justly sen klobuchar said at #demconvention //tco/aoeizsaae
11150,34779,3,abcpolitics new york city mayor bill de blasio confirms reports that his daughter chiara de blasio was arrested at a protest im p…
16166,47344,3,last year biden released his plan for criminal justice reform which pledged to invest million into community policing efforts and would require police to reflect the racial composition of their communities //tco/udwgtaliwl
16563,48573,3,watch tensions flare between reps cedric richmond and matt gaetz during police reform hearing was that a nerve //tco/irkrkdxyg //tco/ndvjqgij
8703,28237,2,dallas pd implements a new duty to intervene order in reaction to the death of george floyd //tco/yveypvohq
11009,34638,4,this is not the time for us to lecture it is time for us to listenformer pres george w bush releases rare public statement on george floyd protests //tco/jbofeyorv //tco/dlaprdvsu
12349,38433,2,the failure of the other police officers to stop george floyds killing may be the biggest challenge via thehillopinion //tco/vqvyflgim //tco/ezbwstxqt
4361,14703,5,san francisco giants relief pitcher sam coonrod was the only player who refused to take a knee prior to the national anthem thursday nor did he bow to the black lives matter agenda //tco/hmodjhswq
9203,29941,2,a decade before george floyd david smith died after minneapolis police kneeled on him heres how the department investigated itself //tco/hbaugcrzr
4959,16166,2,heres what we know about the four expolice officers facing charges in george floyds death their role in his arrest and their lives before and while they were on the force based on their personnel files //tco/jhwtegtv
13847,41604,5,pope francis sends strong message to us catholics after george floyds death //tco/ajumyladf
17434,50584,3,as democrats defund the police movement marches on joe biden and kamala harris are aggressively pursuing their antilaw enforcement agendaeven as leftist riots and looting engulf democratcontrolled cities //tco/wvwhaij
12231,38315,5,crossfit under fire over founders controversial comments on george floyd //tco/ltawpahycf //tco/pusnqcdac
14491,42780,3,vice president of the minneapolis city council andrea jenkins says george floyd and officer chauvin worked at the same restaurant together for seventeen years they were coworkers for a very long time //tco/odobbhhlx
5848,19388,2,unsealed bodycam footage reveals new details of george floyds fatal arrest //tco/yvnzfkef
12605,38689,5,nfl commissioner roger goodell said that the killing of george floyd in minneapolis as well as other recent killings of african americans illustrated an urgent need for action //tco/ckykkxfstg
2303,7314,1,a white man and woman who were captured on video vandalizing a black lives matter street mural in california face hate crime charges officials announced tuesday //tco/xnero
16710,48720,4,new white house says trump may issue executive order on police reform //tco/kwdskikz //tco/spmipuvr
14127,42416,0,here are ten white people who destroyed communities after george floyds death //tco/fmgqzpdoq
6623,21150,2,minneapolis police officers have frequently diagnosed people in custody with excited delirium without consulting medical experts //tco/xrryyjhjyr
8434,27968,2,breonna taylors family amends their lawsuit against the louisville police officers alleging that the raid at her home that ended in her death was connected to a gentrification project //tco/dlznupvqe
9716,30952,3,rep val demings urged a nationwide review of police practices in the wake of the killing of george floyd whose death after he was detained by minneapolis police has sparked protests there for the past week //tco/gwhlbbieg
8764,28298,1,student newspaper in texas identifies a young black man who was critically injured in recent austin protests in an oped entitled his name is justin howell //tco/xcsjmtaqw
3541,11535,1,valrichardson black lives matter mum as black lives claimed by surge in violent crime //tco/diwgxfkte washtimes #blm #c…
4973,16180,1,george floyds story has been the story of black folks says rev al sharpton during his eulogythe reason we could never be who we wanted and dreamed of being is you kept your knee on our neck like george we couldnt breathe you wouldnt take your knee off our neck //tco/vkcozpwxz
14547,43010,0,repgosar this has nothing to do with george floyd — its all about power the violent leftists will defile destroy and burn down you…
15995,47074,3,in the wake of calls to defund police albuquerque creates an alternative department //tco/udcwstk
15966,47045,1,george floyds death in police custody has sparked urgent push for racial reform across the globe there are more stories to tell we are committed to telling them
3493,11487,2,dc police stop black preborn lives matter street painting arrest two protesters //tco/qqqixmtw #mpd
11384,36174,1,george floyd said he cant breathe nearly times on police bodycam footage //tco/dwnalysrz //tco/trfvorpxr
10130,32504,5,watch a group of boston nurses took a knee outside their hospital to show solidarity with protesters //tco/xbttghpe //tco/bpvgsqqaje
16614,48624,4,trump planning to announce police reform executive order //tco/pclcjmf //tco/toqavydqb
8583,28117,0,mourners pay their respects before the funeral for george floyd in houston //tco/mntchevdd📷 callaghan ohare / reuters //tco/xytumxab
2787,8438,5,tucker carlson sees bigname advertisers bolt after comments on black lives matter //tco/qsirsxvcy //tco/jmqqjkfg
5543,17796,0,watch thereval sharpton flattens conservative hugh hewitt for claiming george floyd to blame for covid spikes //tco/eamjjqon
7784,25116,1,im asking you is that what a black man is worth twenty dollars philonise floyd george floyds brother delivers a powerful opening statement before the house judiciary committee in a hearing on police brutality //tco/psrkrb //tco/keahvsyr
10947,34576,3,a pennsylvania county commissioner is facing widespread calls to resign after remarks he made about the black lives matter movement and the protests in philadelphia over the death of george floyd //tco/dkcrwddlhf
16732,48742,3,new biden democrats seek to shut down calls to defund police //tco/litngpfznt //tco/fpalpabpj
11243,34872,1,protest latest //tco/hztxrxclij— protests grow violent in brooklyn—atlanta sees violence spark outside cnn —protest outside white house draws secret service in wake of george floyds death //tco/bikzns
15461,45795,2,civilian oversight on the police force is going to be whats next calnbc reports of police reform in louisville following the city councils passage of breonnas law banning noknock warrants //tco/lwtznekhd
10348,32722,4,minnesota gov tim walz says he is authorizing the full mobilization of the minnesota national guard an action that has never been taken in its year history //tco/xthbwsf //tco/xsxbjjtp
5187,16394,3,new york city mayor bill de blasio has appointed two people to investigate the nypd after a police cruiser was seen hitting a group of protesters saturday //tco/dbmseyhik
5742,18399,1,its not about this is john this is rebecca the photographer al j thompson said of his portraits of protesters in new york i want to direct the audience to understand we are george floyd we are one //tco/eueuthe
6093,19633,2,what is felony murder arimelber explains the new charges filed against the four officers involved in the death of george floyd //tco/uyaupe //tco/rysysfm
7971,26153,2,weapons were the first warning we analyzed dozens of videos spoke with witnesses and reviewed police guidelines to try to understand how the police in philadelphia used tear gas on trapped protesters watch our investigation //tco/zrfoshu
8408,27942,2,a man who vandalized an auto parts store in minneapolis during protests over the death of george floyd is believed to have ties to a white supremacy group and was trying to stir tensions according to a new court filing //tco/mdzuxgvggj
10655,34284,1,this is not murder but a hate crimegeorge floyds niece brooke williams makes impassioned remarks at his funeral saying laws were already put in place for the african american system to fail //tco/qgxmuwgbz //tco/wvwitfpfgg
3153,10312,1,pair who painted over black lives matter mural decry double standard and hypocrisy over hate crime chargewhen we stand up and give them a little iota a taste of their own medicine this is the extreme measures that are being taken //tco/bvdvbmejo
12762,38846,3,excop val demings urges review of police practices after death of george floyd //tco/imytwtjai //tco/plzutfrxh
9487,30225,5,owner of damaged dc restaurant before anyone puts a single word in our mouths black lives matter //tco/nuimdoyuzz
8951,28485,1,demonstrators start a fire near the white house as they protest the death of george floyd📷 alex brandon / ap //tco/ehdbdfvf
17408,50392,0,timcast every single atlanta cop should walk off the jobthis is actually a bipartisan positionthe left wants to defund disband o…
8139,26321,2,fury over the death of breonna taylor a black medical worker who was shot in her home by the police has been growing driving tense demonstrations in louisville kentucky and elsewhere heres what to know about taylors death //tco/djuylxvg
5003,16210,3,george floyd whose death in police custody has sparked massive protests throughout the united states tested positive for the novel coronavirus in a new autopsy report //tco/csrlenjdb
159,251,4,the slain rapper and actors career only lasted five years but some of his music contains lyrics that seem to echo themes now being discussed as black lives matter protests sweep the globe //tco/gkdhsgxm
685,2502,5,mitt romney joins a march protesting the death of george floyd we need to stand up and say that black lives matter //tco/pgltmguk
1,93,2,when it affects your children and other people you see that are helpless thats when you feel you need to stand upatlanta dream player renee montgomery talks about racism and atlanta dream coowner sen kelly loeffler putting out a statement against black lives matter //tco/loqfwooao
1977,6631,1,my black friends matter these young students held signs with powerful messages at a kidfriendly protest in kansas city mo //tco/tuxxhzgfh //tco/psdkoskjk
1424,4975,0,social media giants like facebook publicly support black lives matter and its mission but content on their platforms may be compromising the movement for racial justice listen to todays episode of the daily //tco/pckxcei
211,303,3,houston mayor sylvester turner said he will sign an executive order to ban chokeholds in the city during his remarks at george floyds funeral we will ban chokeholds and strangle holds in this city we will require deescalation //tco/krkbnlrjt //tco/ksgvezjquy
1074,3684,1,hes just shown blatantly over and over again that hes a racist said one black lives matter protester //tco/efygemsi
1314,4712,4,president trump is criticizing new york citys plan to paint black lives matter on th avenue outside trump tower — calling it a symbol of hatethe move comes as trump has stepped up his defense of confederate symbols and monuments //tco/cizmowa
1859,6513,5,husband of los angeles da faces misdemeanor charges after allegedly pointing gun at black lives matter protesters //tco/fysgclcryz
1385,4936,2,at the height of black lives matter protests in new york city the police were repeatedly filmed using force against peaceful protesterswe reviewed more than videos in many force did not appear warranted this thread contains scenes of violence //tco/hzsigalq
32,124,5,every nba player who restarted the leagues season on thursday kneeled during the national anthem wearing black lives matter shirts //tco/atajmvfpd //tco/vapyck
245,337,5,health care workers around the country have held rallies and marches in solidarity with the black lives matter protests in response to the death of george floyd //tco/kzqeuflea
207,299,3,the dc council has passed an emergency bill to reform policing including measures that ban the use of tear gas and rubber bullets and prohibit the hiring of officers who were fired from another police department //tco/wmjgcbk
1227,4242,3,the potential running mates calls for reform have grown sharper as protests over police violence spread orlando activists say its too little too late //tco/cmrwkgdjf
1500,5350,3,washington dc mayor on creation of black lives matter plaza during #demconvention i said enough i said enough for every black and brown american who has experienced injustice enough for every american who believes in justice //tco/ckzrqxtqw //tco/ficrogj
688,2505,5,black lives matter cofounder alicia garza we see companies and corporations across the nation saying yes yes black lives matter but we havent actually dived into what are your practices when it comes to your black employees //tco/gcmpnanr
1976,6630,0,cbseveningnews protesters around the country are toppling confederate statues and other monuments that they see as historic symbols of…
572,2183,1,everything you need to know about defunding the police which has become a central tenet of the black lives matter movement //tco/hjmamleove
176,268,1,patrick hutchinson the black man seen carrying an injured white man to safety during a chaotic scene at protests in london tells cnn he did it to avoid catastrophe //tco/fwfraqdibf //tco/wtmyyau
1682,5815,1,tulsa protesters use race massacre tombstones to defend a black lives matter mural //tco/emgxxvou
1429,4980,1,jmartnyt new back on the trail — in ky bookerky may fall short but he has harnessed blm in a state boiling w anger to overcome a…
1546,5396,2,three people have been arrested and a fourth was issued a summons after a black lives matter mural on manhattans fifth avenue in front of trump tower was vandalized with blue paint friday afternoon police say //tco/tbqhqptn
1832,6215,3,the section of th street in front of the white house is now officially black lives matter plaza dc mayor muriel bowser tweeted a sign was put up to mark the change📷 getty //tco/vtzgpcayp
791,2889,0,americas pop stars spent the spring trying to write the song for our moment its a black lives matter anthem that may prevail //tco/mirohpwruo
179,271,5,amid unprecedented civil unrest in response to police brutality across the country trumps campaign is offering a onesie for babies on its website with the words baby lives matter in the script and style of the black lives matter movement logo //tco/xagbkgvk
590,2201,0,there is a lot of pressure that is mounting in this moment and i just hope that our government chooses to do the right thing the community organizer opal tometi said this is just the beginning //tco/piznvmet
648,2465,3,if chosen as joe bidens running mate rep demings says she would partner with black lives matter to create advisory boards on police misconduct and substandard housing…education…lending other areas where we frequently see discrimination and racism //tco/jrvwmfwg
542,1748,1,watch child left sobbing after woman threatens to kill her mother for participating in black lives matter rally //tco/tneoi
970,3327,3,minneapolis city council has pledged to dissolve the citys police department and build a new public safety systemcity council president lisa bender said lawmakers voted for this move because our efforts at incremental reform have failed period //tco/kzbjryvsa
105,197,0,new research suggests black lives matter protests across the us have not led to a jump in coronavirus cases //tco/ntrqiqmylp
1293,4691,1,at a black lives matter protest a young korean american man named edmond hong grabbed a megaphone addressing other asian americans he described the need to stop being quiet in the fight against racism hear why on this episode of nprcodeswitch //tco/lqrbztuqf //tco/btlwdtn
172,264,0,the us embassy in seoul south korea has removed a large banner for the black lives matter movement after a request from state department leadership and has taken down a rainbow flag that celebrates lgbtq pride //tco/oullmds
1626,5476,1,watch black lives matter cofounder alicia garza explains the phrase defund the police means invest in the resources that our communities need //tco/rbkgunrpm
1259,4274,0,as one publichealth expert told the daily beast this week we have to be careful that racial injustice isnt compounded by health injustice //tco/ofkcvfzrj
1334,4732,3,after an unveiling attended by dc mayor muriel bowser black lives matter now adorns an official street sign near the white house — and a yellowlettered mural that spans two city blocks //tco/mfknjqj
1929,6583,0,six flags apologizes for questioning guests shirts supporting racial justice //tco/aitybimskx
1764,5897,5,what made roger goodell say black lives matter and where it leaves the nfl //tco/muggyrxxu
384,1590,1,go home racists blm counterprotesters shout down white nationalists in stone mountain georgia //tco/nzfjohqrlb
709,2807,1,some people that think that just playing and seeing black lives matter on the floor is sufficient others think participating in protest and funding voter registration efforts—or going on strike—are appropriate //tco/ggckbngbq
1511,5361,0,a recent installment of longrunning syndicated comic strip six chix tackling antimask rhetoric from a black lives matter movement perspective was pulled from some newspapersthis is a complete step back in the wrong direction the artist said //tco/mfpedjkcp
404,1610,0,yearold girl gets hit and knocked to the ground as men yelling all lives matter confront blm marchers //tco/blpveptp
1597,5447,1,public enemy anthem fight the power struck chord long before black lives matter protests //tco/ftzxyzty
71,163,0,a white man and a white woman who allegedly painted over a california communitys black lives matter mural are each facing a hate crime charge the contra costa county district attorneys office says //tco/bdnkmkyfh
1260,4275,5,the nfl released a video of commissioner roger gooddell admitting to having failed to listen to players who protested racial injustice and police brutality //tco/ektvpouk
1700,5833,5,britons toppled a slavers statue a guerrilla artist replaced it with a black lives matter protester //tco/ooqttmcfq
1296,4694,5,dolly parton tells billboard magazine that she supports the protest movement following the killing of george floyd and its push for racial justice i understand people having to make themselves known and felt and seen and of course black lives matter //tco/mfcrxul
