id,rowid,entity,text
113,205,2,as protests continue in the us the black lives matter movement is also spreading across the globe cnn heads to the uk australia and france to see how people are seeking to end systemic racism and police brutalitywatch go there on facebook //tco/eburrerry
1068,3678,2,participants in rome listened to speeches and held up placards saying black lives matter and its a white problem //tco/lhghokpd
1482,5332,1,watch portland mayor ted wheeler slams president trumps response to national protests amid a deadly shooting in portland that happened after trump supporters and black lives matter protesters clashed its you who have created the hate and division //tco/pfrjnsvwe
1669,5802,1,it can be a huge challenge to explain #blacklivesmatter to nonblack families of color especially for families who havent grown up in america this week the new normal with navigatingnikki tackles colorism the model minority myth and more //tco/yjqwtrxg
1022,3632,5,mark and patricia mccloskey threatened a group of black lives matter protesters with their weapons late last month //tco/jwhpyhcxx
1620,5470,2,nbclatino latino communities in northern new jersey rally together to fight for justice at black lives matter protest //tco/c…
1997,6651,2,dr kerry anne amp mr michael gordon decided to have a mini wedding in place of their original date during their first look protesters walking by gathered around them chanting black lives matter and their officiant reverend roxanne birchfield captured this powerful moment //tco/sgoaxun
226,318,2,kpops most popular group donated million in support of the black lives matter movement their fan base has more than matched that //tco/icdnupzx
1505,5355,2,wnba players wear vote warnock shirts on tuesday in opposition to atlanta dream coowner sen loeffler over her opposition to the black lives matter movement //tco/vjvqkto
191,283,2,businesses have an obligation to be supportive of black lives matter don peebles founder and chairman of the largest us blackowned real estate development company tells smerconish it means black ambition matters it means black access to economic opportunity matters //tco/yzvgprqhf
1086,3696,2,big bird and elmo will address the demonstrations and racial justice issues in a virtual cnn town hall this weekend //tco/mvnexrrqf
437,1643,1,there is no racism couple destroying black lives matter mural faces off against bystanders //tco/erpghvay
1347,4898,2,i have been educated by my children many young people after organizing online sharing resources and marching have kept conversations about racism and change going at home //tco/ljlxgjmu
1547,5397,0,statue of black lives matter protester that replaced toppled slave trader in bristol england has been removed after hours //tco/alozaich
1983,6637,1,minnesota state troopers admit strategically deflating tires during george floyd protests //tco/ivzpdnel
72,164,2,the players of the wnbas atlanta dream jointly signed a statement supporting the black lives matter movement which they assert is a statement of humanity team coowner sen kelly loeffler objected to the wnbas plans to honor the movement //tco/rkkkzylchq
1354,4905,0,a virginia man who prosecutors say admitted to being a member of the ku klux klan was sentenced to years in prison after driving through demonstrators at a black lives matter protest in june //tco/kvfylpa
45,137,2,the late rep john lewis motorcade stops at black lives matter plaza just steps from the white houselewis visited the mural which was painted in june and called it a powerful work of art //tco/xgcigvuj //tco/mqzucgzj
1402,4953,2,tu lucha es mi lucha several signs read at a recent black lives matter protest in arizona your struggle is my struggle many latinos are backing black lives matter protests while pushing for an acknowledgment of the systemic racism they face //tco/vyinmgbp
139,231,0,an officer involved in the fatal shooting of breonna taylor is in the process of being fired louisvilles mayor says //tco/vozzjdcs
1913,6567,1,white couple who pointed guns at st louis protesters claims angry mob threatened them //tco/ifykensn
920,3277,1,part of the power of black lives matter as a social movement is to say the individualfocused narrative that surrounds the us is a false narrative says drjonathanrosawhy the language we use when we talk about race matters so much //tco/jhdfrngxt
677,2494,5,the only language they seem to understand is protest outside their office and sometimes outside their front doorsdr melina abdullah cofounder of black lives matter los angeles on pushing city leaders to enact police reforms //tco/didndvlhd
1376,4927,0,tents popped up as a downtown square turned into a more permanent spot to gather but in late june after a protester was shot and killed there the louisville metro police department dismantled the camps and said that the park was to be closed nightly //tco/khurffj //tco/kelwekqyw
1503,5353,1,nbcout markdavid hutt founder of the lgbtrump facebook page was arrested twice in one weekend for vandalizing a black lives matter…
803,2901,2,americas pop stars spent the spring trying to write the song for our moment its a black lives matter anthem that may prevail //tco/xxwumxhaxg
708,2806,2,some people that think that just playing and seeing black lives matter on the floor is sufficient others think participating in protest and funding voter registration efforts—or going on strike—are appropriate //tco/fqteveycja
1460,5011,0,kevinq new in todays upshot we contextualize the large shift in voters attitudes about black lives matterin the span of a couple…
489,1695,1,watch tulsa cops hustle away black lives matter protester after trump rally staffer tells her shes uninvited //tco/jdgewgiso
1413,4964,2,a majority of american voters support demonstrations against police brutality and racial injustice embracing central tenets of the black lives matter movement a new national poll shows //tco/ifpdtljq
1244,4259,0,apple and google have updated their voice assistants with new responses to the questions do black lives matter and do all lives matter //tco/kirlwad
1807,6190,2,de blasio announced last month that the city would paint black lives matter on streets at locations around the city the first such blocklong message was this one put on a street in brooklyn 👇📷 ap⁣⁣ //tco/uslkrubamk
1653,5503,2,blackout tuesday was created initially to call on those in the music industry to take a beat for an honest reflective and productive conversation about racial inequality and the ways in which it has profited predominantly from black art //tco/cxwglfzjlu
1963,6617,2,artists unveil black lives matter street mural in new york city //tco/nuzjvphlh
103,195,1,on monday president trump went after attempts to strip the names of racists from buildingson tuesday it was a federal housing rule meant to combat racial segregationby wednesday trump was calling the words black lives matter a symbol of hate //tco/zstmwyjhp
1161,4176,1,tucker carlson calls black lives matter protests a pandemic minneapolis was our wuhan //tco/hsaorkvcue
230,322,2,jennifer lopez and alex rodriguez walked with protesters on sunday in los angeles as part of a black lives matter march //tco/zywomrwhc
301,1194,1,what did i do cops surround black lives matter activist on suspicion of using megaphone //tco/hwejakhqvd
892,3249,2,how george floyd and black lives matter changed the democratic party //tco/bwnbkjin
556,1762,1,watch protesters tackle man carrying semiautomatic rifle at texas black lives matter protest //tco/lsekoiir
1419,4970,5,nytmag if black lives are to matter in america the nation must pay its debts a new essay by nikole hannahjones //tco/ukuql…
955,3312,0,im a guy who happened at that point to just vote republican as far as im concerned id like to see the destruction of the twoparty systemwhy nathan a selfdescribed libertarianleaning republican is protesting with black lives matter //tco/jtopfxvthh
236,328,5,kpops most popular group donated million in support of the black lives matter movement their fan base has more than matched that //tco/zieesixmc
1405,4956,0,with images of americas racial strife rolling across the news some in japan have insisted that institutional racism is a faraway problem but japan has a longstanding history of discrimination against minorities //tco/mrvumccu
1876,6530,0,uk city removes statue of black lives matter protester that replaced monument to a slave trader //tco/nngxzwfekt
252,344,1,black lives matter protests arent just happening in big cities — people in small towns are also protesting with acts of solidarity //tco/yzxafqmaz //tco/pyqsbsnkhq
1176,4191,5,its not blatant inyourface racism that you would see in america the writer jordan anderson observes of racism in italy that doesnt mean its better just different //tco/wdlgaio
554,1760,5,deputy gets called out after sporting extremist symbols at black lives matter protest – and then gets put on leave //tco/uejjnmgt
177,269,0,patrick hutchinson the black man seen carrying an injured white man to safety during a chaotic scene at protests in london on saturday told cnn he did it to avoid catastrophe //tco/odfdjwm //tco/gkoukqhe
1992,6646,1,us protests prompt calls for britain to tackle its own systemic racism //tco/ardoftdm
46,138,0,the black lives matter street mural outside trump tower in midtown manhattan was vandalized again on sunday according to policethis marks at least the fourth time the mural has been vandalized since it was created on july //tco/lfmzz
951,3308,1,the george floyd protests went global and stayed that wayat demonstrations across the world the dynamics were the same in many places solidarity with the united states and calls for changes at home //tco/czqvesdm
1608,5458,5,a philadelphia court supervisor who was captured on cellphone video taking down antiracism signs in a public area and saying black lives dont matter to him has been fired //tco/ugqpsvnl
241,333,1,antiracism protesters in england have pulled down a statue of a thcentury slave trader while demonstrating in solidarity with the us black lives matter movement //tco/mvwksdqlq
1499,5349,5,nbcblk the first hour of the convention brought repeated references to the black lives matter movement the disproportionate number of…
60,152,0,the black lives matter street mural in front of trump tower has been vandalized three times in one week according to the nypd the latest incident occurred saturday afternoon when two women were arrested after they were seen pouring paint on the mural //tco/hmpmjfe
1922,6576,1,pence said the leaders of the black lives matter movement push a political agenda of the radical left //tco/lohoupkr
1330,4728,5,some of the loudest voices speaking up against racism and police brutality have come from the sports world because of the huge vacuum that exists in leadership in the white house it is a tremendous opportunity professor kenneth shropshire says //tco/kfvfkikuo
1243,4258,5,i would be much more inclined to march with them carson said of the black lives matter movement if they were also concerned with all those people dying in other places around the country //tco/ncecjrexp
407,1613,2,trump campaign paying matt schlapp lobbying firm after clients bolt over his black lives matter comments //tco/lbvmoxxfq
411,1617,5,sen lindsey graham goes on fox news to explain the big difference between john lewis and #blm protesters //tco/kfepsupu
1153,4168,0,a las vegas man accused of conspiring in a plot to incite violence at a black lives matter rally as part of a boogaloo plot is being investigated for alleged child sex abuse //tco/qrhejsqle
907,3264,1,almost two months later protests for black lives are still going strong in cities and towns across america //tco/ssiyndneio
1954,6608,5,miss universe zozibini tunzi on the black lives matter movement you dont get to sit down and not do anything right now //tco/towbrofckx
434,1640,5,workplace tensions flare over whether employees can wear black lives matter masks //tco/naclmyx
1308,4706,5,the wnba says it will dedicate the season to addressing the nations long history of inequality implicit bias and racismplayers will wear warmup shirts with the words say her name and black lives matter //tco/timctcaqtr
1444,4995,0,shanegoldmacher new money has absolutely flooded into bail funds blackled groups and racial justice organizationsjust one data p…
1643,5493,0,community members join city workers in painting a giant black lives matter mural on th street near the white house on friday //tco/pnyhajkkq
261,353,5,canadian prime minister justin trudeau took a knee during a black lives matter demonstration in ottawa //tco/ahqlsxnaus
168,260,0,surfers around the world are paddling out to sea in support of the black lives matter movement to protest injustice and pay tribute to black lives lost to police brutality //tco/kwhameidy
426,1632,4,trump tells fox news the #blacklivesmatter sign on fifth avenue is like hes being prosecuted //tco/gwefiux
75,167,5,streaming platform twitch found itself in hot water for the second time in a week after it posted a video that was intended to support the black lives matter movement but featured an overwhelming number of white creators //tco/pveqaiiaei
1962,6616,5,the ceo of a san franciscobased skin care company apologized sunday for calling police on a man who was stenciling a black lives matter sign in chalk in front of his own home //tco/nmzaekvryl
1351,4902,5,the prime minister said there was no slavery in australia these pacific islanders tell a different story as the black lives matter movement offers a rare opportunity to make their family histories known //tco/jgqdtuvuo
1137,4152,1,a coalition of chicago civilrights groups is seeking a federal judges injunction to keep chicago from becoming the next city besieged by state violence //tco/wontgdi
980,3337,5,#blackouttuesday raised important questions about allyship vs performativity on social media //tco/itkfslizx
251,343,1,protesters have gathered in major cities across australia demanding justice over minority deaths in police custody in solidarity with the black lives matter movement //tco/tipynprwv
519,1725,0,nazitattooed man arrested for armed impersonation of a federal officer at #blacklivesmatter protest report //tco/vfhuakrhk
238,330,1,banksys piece is composed of a framed black figure with a candle and flowers surrounding it an american flag hanging overhead has been lit on fire by the candle beneath //tco/zcmivnosj
1229,4244,5,mota skates posted a venn diagram on instagram stating its ok to be all three showing overlaps between outraged by george floyds death not condoning looting or rioting and supporting good police officers skaters called them out //tco/btoxyjhu
1254,4269,1,a statue memorializing british slave trader edward colston has been pulled down by black lives matter protesters in bristol england //tco/jqeigyn
1262,4277,5,once again the oscars have sworn theyll do better on race—and once again its because of ava duvernays selma //tco/vcdnqtlu
1488,5338,1,a teenager from englewood cliffs new jersey says she received a nearly bill from the mayor after she held a black lives matter protest in the borough last month //tco/nxpiw
1943,6597,4,pence wouldnt say black lives matter in interview on juneteenth //tco/kqxkez
1972,6626,5,starbucks reverses policy allowing employees to wear black lives matter attire //tco/ekyhqmmo
696,2513,3,dc mayor bowser had city workers friday paint the words black lives matter on the street that leads to the white house where protesters have been demonstrating following george floyds death in police custody //tco/rdobfil
424,1630,0,watch enraged trump fan shrieks profanity after seeing drivers black lives matter display //tco/dedejdc
631,2448,1,thereval says the black lives matter mural on fifth avenue in new york city is particularly symbolic on the street where they have all of the great shops and where trump tower is //tco/orhzumebm
1240,4255,5,fedex has fired an employee who pulled a sick knee pose in front of black lives matter protesters //tco/igmtrnlbtq
1333,4731,5,new the nfl says it was wrong for not listening earlier to players protesting racial injustice — and encouraged them to speak out we the nfl believe black lives matter the leagues commissioner said //tco/bpsqvmyep
1112,4127,0,those topsyturvy partisan habits of swing voters have become more mysterious and unpredictable especially as the conversations on race have come to town //tco/cgiptlm
769,2867,0,defund karen on the insults acronyms and sloganeering of americas racial reckoning //tco/rdzqlfjq
204,296,3,last week dc mayor muriel bowser renamed a section of the street directly in front of the white house black lives matter plaza it was also painted in giant yellow lettersgoogle updated its maps to include the new black lives matter plaza nw name //tco/dxujiaf
1952,6606,4,rolling stone senior writer jamilsmith joins cbsn to discuss the protests against police violence and systemic racism — through the lens of the women who first put the words black lives matter into our political lexicon years agofull interview //tco/aeitouss //tco/mniezvkkt
1437,4988,0,s evangelina after arthur ashes statue in richmond virginia was vandalized with white lives matter graffiti i spoke to his nephew…
1633,5483,5,meetthepress tune in a nation on the brink of a turning point cofounder of the black lives matter movement aliciagarza joins for…
1903,6557,0,catholic priest in indiana suspended for comparing black lives matter to maggots //tco/mgmny
670,2487,1,counter protesters including a corrections officer mock george floyds death during a black lives matter marchi thought about the young children who were marching behind me says march organizer daryan fennalreporting from nbcphiladelphia //tco/bmkvjqepu
33,125,5,every nba player who restarted the leagues season on thursday kneeled during the national anthem wearing black lives matter shirts //tco/oatbastbq //tco/nfzpdomq
917,3274,5,aunt jemima the redskins lady antebellum the dixie chicks fair amp lovely — after this years black lives matter protests plenty of brands are finally ready to ditch names rooted in racist history but what does a name change really accomplish //tco/csayrpjnx
133,225,5,jason mraz is honoring juneteenth by donating all of the profits from his new album to black lives matter and other organizations working toward equality and justice //tco/zjvkjmfr
1726,5859,0,a driver hit black lives matter protesters it was a neighboring towns mayor protesters say //tco/ehulfvyh
302,1195,0,black mom told to take yearolds black lives matter chalk art to other neighborhood //tco/djtrsvthea
153,245,1,about twothirds support the recent black lives matter protests over police brutality and discrimination in the us and theres agreement on a wide variety of proposals on how to reform the nations police departments recent polls show //tco/hpdwhintbf
49,141,1,its been two months since george floyds death and protesters across america are still pounding the pavement heres why they refuse to quit //tco/fipwdusllv
1718,5851,4,trump lashes out at black lives matter accuses one member of treason //tco/sfmounthrr
1483,5333,3,watch portland mayor ted wheeler slams president trumps response to national protests amid a deadly shooting in portland that happened after trump supporters and black lives matter protesters clashed its you who have created the hate and division //tco/huwtscdmw
1149,4164,0,mark and patricia mccloskey a st louis couple who found national fame after they were filmed brandishing weapons at blm protesters who passed their mansion in a gated community reportedly have a long history of telling people to get off their lawn //tco/vgkbpydzz
1680,5813,5,from the magazine in portland the spotlight on the wall of moms underscored the constant presence of the white ally — for better or worse //tco/evocrze
1912,6566,5,nba reportedly plans to paint black lives matter on courts when season resumes //tco/cagugwec
934,3291,1,heres whats behind global black lives matter protests //tco/wiowtteop
1350,4901,1,bellakwai the blm movement has offered a moment for south sea islanders ssi descendants of pacific island laborers who helped make q…
911,3268,0,reforming defunding and abolishing the police are all different concepts heres what they each involve and why theres so much debate and confusion over them //tco/mucqbhj
344,1237,1,iowa activists chant black lives matter as governor signs ban on police chokeholds into law //tco/glnndva
315,1208,5,despite corporate messaging in support of black lives matter companies are banning ads in stories //tco/qnvxpaykr
220,312,0,eric michael tamir philando atatiana breonna and georgewe only knew their names after they died but you can find them all on a popular name planning website for prospective parentseach of these names was somebodys baby the site reads //tco/fxexnaqxx
110,202,1,new research suggests black lives matter protests across the us have not led to a jump in coronavirus cases //tco/xecvqpkdf
834,2932,0,the history behind the antiblack lives matter protests in merrick ny //tco/iixrxz
916,3273,1,what black lives matter protests in a conservative majoritywhite enclave of california tell us about a changing america //tco/ztjjuzbejt
800,2898,5,americas pop stars spent the spring trying to write the song for our moment its a black lives matter anthem that may prevail //tco/nevoqpudb
1461,5012,0,american voters support for the black lives matter movement has increased in the last weeks almost as much as it had in years according to new data from an online survey research firm //tco/rtkchcw
350,1243,4,republican party rebukes las vegas mayor pro tem for racially charged comments about blm //tco/dbwuwlxqq
1373,4924,1,bymikebaker it began with black lives matter chalk art at the end of a deadend street now police officials in a small town are thr…
271,363,5,we know thats it no intent to harm but to be frank this essentially does harm the message mental health advocate and black lives matter activist kenidra woods wrote we use hashtag to keep ppl updated pls stop using the hashtag for black images //tco/zoaobaq
1440,4991,5,nytgraphics in the print edition of tuesdays nytimes an page special section on the black lives matter protests that have swept ac…
262,354,0,police are searching for a cyclist who was filmed accosting people posting signs supporting black lives matterit shows how pernicious and how pronounced and how embedded racism is in our culture montgomery co md council member will jawando says //tco/yxpvamdhkw //tco/tfijwmtjqg
843,2941,1,we need to stand up and say that black lives matter romney said while marching //tco/secvnoc
1582,5432,1,an employee at a target store on long island new york says she was confronted by a customer who demanded she remove a black lives matter mask because they found it offensive //tco/ljhpyynt
1931,6585,1,this yearold boy is earning money by mowing his neighbors lawns – and hes giving all of it to the black lives matter movement //tco/lmeztxhdr //tco/mysipihcft
1955,6609,1,miss universe zozibini tunzi on the black lives matter movement you dont get to sit down and not do anything right now //tco/enyzqpef
1512,5362,1,as black lives matter protests continue across the country at least a dozen schools have rescinded student admissions offers over racist social media posts todayshow //tco/vwqtctydqb
472,1678,1,black family cuts texas vacation short after finding racist white lives matter sign on their front door //tco/zgsklyvta
1779,5912,5,perspective on his th birthday malcolm xs urgent message resonates at a time of racial inequity in the healthcare and criminal justice systems //tco/lvnbijbqqa
1189,4204,5,juan williams condemned his fox news cohosts for actively demonizing the black lives matter protesters while failing to mention other bad actors on the scene during the demonstrations //tco/qmpnyqsi
1565,5415,0,nbclatino the diversity of staff members has received greater scrutiny amid the black lives matter movement and as democrats represent…
382,1588,2,you won seattle cop tells protesters hes quitting the police force because of black lives matter //tco/enfmdagli
898,3255,1,today explained episode ⤵️the #blacklivesmatter protests are changing our language from karen to bipoc to black and white…
1346,4897,1,paintballs and pepper spray filled the air in front of the us courthouse in portland oregon as propolice demonstrators and black lives matter supporters clashed on saturday police officers watched from a distance and chose not to intervene //tco/mwfvgwds
296,1189,5,dolly parton says of course she supports black lives matter //tco/nenwdgh
1761,5894,5,japanese tennis player naomi osaka speaks out for black lives matter faces backlash //tco/lwsirgvk
1379,4930,1,its been more than a month since protests began in louisville following the killings of george floyd and breonna taylor demonstrations are still going on every day — and protesters say theyll continue until there is justice for breonna taylor //tco/jqohdgk
308,1201,1,guess who turned richmonds blm protests into riots this weekend //tco/pgkcptmhw
169,261,0,patrick hutchinson the black man seen carrying an injured white man to safety during a chaotic scene at protests in london tells cnn he did it to avoid catastrophe //tco/nootulgbb //tco/anteqg
1246,4261,5,crossfitaffiliated gyms across the country where owners pay yearly funds to use the regimes branding began divesting from the corporate structure this weekend after its ceo greg glassmans controversial tweets on the black lives matter movement //tco/pkuqxvm
